{
  "schema_version": "0.1.0",
  "request_id": "req-fake-0001",
  "workflow_id": "wf-fake-54t",
  "timestamp": "2026-01-01T00:00:00Z",
  "environment": "development",
  "jurisdiction": "test-only",
  "data_classification": "internal",
  "actor_id": "human-fake-operator",
  "actor_type": "human",
  "agent_id": "agent-54t-docs",
  "agent_version": "0.1.0",
  "tool_id": null,
  "tool_version": null,
  "policy_id": "54t-core",
  "policy_version": "0.1.0",
  "policy_gate": "default-deny",
  "output_hash": null,
  "previous_receipt_hash": null,
  "signing": {
    "algorithm": "planned",
    "key_id": "planned",
    "signature": null
  },
  "metadata": {
    "synthetic": true
  },
  "notes": "Synthetic validation fixture; no raw sensitive content.",
  "action": "settle expired test wallet transfer",
  "action_class": "wallet",
  "risk_level": "critical",
  "autonomy_tier": "A3",
  "decision": "deny",
  "decision_reason": "Approval expired before execution.",
  "approval_status": "expired",
  "wallet_details": {
    "initiator_id": "human-fake-initiator",
    "chain": "fake-test-chain",
    "asset": "TST",
    "amount": "12.34",
    "destination": "fake-destination-000000",
    "normalized_transaction_hash": "sha256:3e3bb2c03b6f3770bd5f8cc02241e03ca86f2f98fd911a0f0748dde237b50a53",
    "replay_nonce": "wallet-nonce-expired-0001"
  },
  "input_hash": "sha256:d1357ac95da47bb9300de5f1d3f02d5f0a8d2e76eadc380b1ee8b23bed637340",
  "expires_at": "2026-01-01T00:06:00Z",
  "receipt_id": "rcpt-wallet-approval-expired",
  "nonce": "nonce-wallet-approval-expi"
}
