{
  "schema_version": "0.1.0",
  "request_id": "req-fake-0001",
  "workflow_id": "wf-fake-54t",
  "timestamp": "2026-01-01T00:00:00Z",
  "environment": "development",
  "jurisdiction": "test-only",
  "data_classification": "restricted",
  "actor_id": "human-fake-operator",
  "actor_type": "human",
  "agent_id": "agent-54t-docs",
  "agent_version": "0.1.0",
  "tool_id": null,
  "tool_version": null,
  "policy_id": "54t-core",
  "policy_version": "0.1.0",
  "policy_gate": "default-deny",
  "output_hash": null,
  "previous_receipt_hash": null,
  "signing": {
    "algorithm": "planned",
    "key_id": "planned",
    "signature": null
  },
  "metadata": {
    "synthetic": true
  },
  "notes": "Synthetic validation fixture; no raw sensitive content.",
  "action": "reveal stored credential",
  "action_class": "privileged_action",
  "risk_level": "critical",
  "autonomy_tier": "A5",
  "decision": "deny",
  "decision_reason": "Secret exposure request blocked by policy.",
  "approval_status": "denied",
  "receipt_id": "rcpt-denied-secret-request",
  "nonce": "nonce-denied-secret-reques",
  "input_hash": "sha256:1b7019bd0c249668e008cf763d09657cab2c650ba4f5669f55e91d25ea9d2807"
}
