{
  "schema_version": "0.1.0",
  "request_id": "req-fake-0001",
  "workflow_id": "wf-fake-54t",
  "timestamp": "2026-01-01T00:00:00Z",
  "environment": "development",
  "jurisdiction": "test-only",
  "data_classification": "internal",
  "actor_id": "human-fake-operator",
  "actor_type": "human",
  "agent_id": "agent-54t-docs",
  "agent_version": "0.1.0",
  "tool_id": null,
  "tool_version": null,
  "policy_id": "54t-core",
  "policy_version": "0.1.0",
  "policy_gate": "default-deny",
  "output_hash": null,
  "previous_receipt_hash": null,
  "signing": {
    "algorithm": "planned",
    "key_id": "planned",
    "signature": null
  },
  "metadata": {
    "synthetic": true
  },
  "notes": "Synthetic validation fixture; no raw sensitive content.",
  "action": "process untrusted document",
  "action_class": "tool_execution",
  "risk_level": "high",
  "autonomy_tier": "A3",
  "decision": "quarantine",
  "decision_reason": "Untrusted content attempted to redefine authority.",
  "approval_status": "pending",
  "receipt_id": "rcpt-quarantined-prompt-injection",
  "nonce": "nonce-quarantined-prompt-i",
  "input_hash": "sha256:e7da69ed172a599a097b1f47ea10b94b8f98cf15e60ce65b45a7d5f9dfee2d41"
}
