{
  "schema_version": "0.1.0",
  "request_id": "req-fake-0001",
  "workflow_id": "wf-fake-54t",
  "timestamp": "2026-01-01T00:00:00Z",
  "environment": "development",
  "jurisdiction": "test-only",
  "data_classification": "public",
  "actor_id": "human-fake-operator",
  "actor_type": "human",
  "agent_id": "agent-54t-docs",
  "agent_version": "0.1.0",
  "tool_id": null,
  "tool_version": null,
  "policy_id": "54t-core",
  "policy_version": "0.1.0",
  "policy_gate": "default-deny",
  "output_hash": null,
  "previous_receipt_hash": null,
  "signing": {
    "algorithm": "planned",
    "key_id": "planned",
    "signature": null
  },
  "metadata": {
    "synthetic": true
  },
  "notes": "Synthetic validation fixture; no raw sensitive content.",
  "action": "read public status",
  "action_class": "read",
  "risk_level": "low",
  "autonomy_tier": "A0",
  "decision": "allow",
  "decision_reason": "Read-only public status request.",
  "approval_status": "not_required",
  "receipt_id": "rcpt-allowed-low-risk",
  "nonce": "nonce-allowed-low-risk.jso",
  "input_hash": "sha256:e28590d88cb26346eb8811ea9d79655fdebc3cae02e3404fefeaf67ae468a659"
}
